{
  "$schema": "https://json-schema.org/draft/2020-12/schema",
  "$id": "https://conveyor.dev/schemas/conveyor.agent_usage@1.json",
  "title": "Conveyor Agent Usage",
  "description": "A structured cost/latency record for a single real agent run (R2a cost instrumentation). The canonical source is the adapter's RawRunResult.metadata (tokens/cost_usd_estimated/latency_ms); this is the durable projection. cost_usd is an ESTIMATE (Codex reports tokens, not dollars; ~$0 marginal under a subscription) — tokens are the real signal. `arm`/`task` are present when the run is part of a lift duel.",
  "type": "object",
  "additionalProperties": false,
  "required": [
    "schema_version",
    "adapter",
    "tokens",
    "cost_usd_estimated",
    "latency_ms"
  ],
  "properties": {
    "schema_version": { "const": "conveyor.agent_usage@1" },
    "adapter": { "type": "string", "minLength": 1 },
    "model": { "type": ["string", "null"] },
    "reasoning_effort": { "type": ["string", "null"] },
    "arm": { "type": "string", "minLength": 1 },
    "task": { "type": "string", "minLength": 1 },
    "tokens": { "type": "integer", "minimum": 0 },
    "cost_usd_estimated": { "type": "number", "minimum": 0 },
    "latency_ms": { "type": "integer", "minimum": 0 }
  }
}
