[{"adapter":"codex","arm":"vanilla","cost_usd_estimated":0.176655,"latency_ms":34167,"reasoning_effort":"medium","schema_version":"conveyor.agent_usage@1","task":"patch_unknown_id_returns_200","tokens":130299},{"adapter":"codex","arm":"vanilla","cost_usd_estimated":0.222114,"latency_ms":55560,"reasoning_effort":"medium","schema_version":"conveyor.agent_usage@1","task":"completed_not_persisted_to_list","tokens":161675},{"adapter":"codex","arm":"vanilla","cost_usd_estimated":0.232327,"latency_ms":47080,"reasoning_effort":"medium","schema_version":"conveyor.agent_usage@1","task":"default_completed_missing","tokens":171267},{"adapter":"codex","arm":"conveyor","cost_usd_estimated":0.164258,"latency_ms":32165,"reasoning_effort":"medium","schema_version":"conveyor.agent_usage@1","task":"patch_unknown_id_returns_200","tokens":121480},{"adapter":"codex","arm":"conveyor","cost_usd_estimated":0.188306,"latency_ms":43466,"reasoning_effort":"medium","schema_version":"conveyor.agent_usage@1","task":"completed_not_persisted_to_list","tokens":135119},{"adapter":"codex","arm":"conveyor","cost_usd_estimated":0.181291,"latency_ms":44477,"reasoning_effort":"medium","schema_version":"conveyor.agent_usage@1","task":"default_completed_missing","tokens":134372}]